Test Case ID,Description,Priority,Status,Steps to Reproduce,Preconditions,Expected Results,Actual Results,Assigned To,Created By,Created Date,Last Updated Date
TC122,Test for unauthorized access to admin panel,High,To Be Tested,"Attempt to access admin panel without proper credentials","Admin panel has restricted access","Access denied message is shown",To Be Tested,QA1,QA2,2023-05-02,2023-05-02
TC123,Verify data retention policy compliance,Medium,To Be Tested,"Check if old data is purged according to policy","Data retention policy is established","Old data is purged in compliance with the policy",To Be Tested,QA2,QA3,2023-05-03,2023-05-03
TC124,Check for CSRF protection on forms,High,To Be Tested,"Submit a web form with and without CSRF token","CSRF protection is enabled","Form submission is successful only with a valid CSRF token",To Be Tested,QA3,QA1,2023-05-04,2023-05-04
TC125,Test user profile customization features,Low,To Be Tested,"Customize user profile settings","User profiles are customizable","Profile customization is saved and displayed correctly",To Be Tested,QA1,QA2,2023-05-05,2023-05-05
TC126,Validate social media sharing functionality,Medium,To Be Tested,"Share content on social media platforms","Social media integration is configured","Content is shared successfully on selected platforms",To Be Tested,QA2,QA3,2023-05-06,2023-05-06
TC127,Test email change confirmation process,Medium,To Be Tested,"Change user's email and confirm from new email","Email change process in place","Confirmation email is sent, and change is effective upon confirmation",To Be Tested,QA3,QA1,2023-05-07,2023-05-07
TC128,Verify application behavior under custom zoom levels,Low,To Be Tested,"Access application with browser zoom levels changed","Application is responsive","Application remains functional and readable at various zoom levels",To Be Tested,QA1,QA2,2023-05-08,2023-05-08
TC129,Test for link integrity throughout the application,Medium,To Be Tested,"Check all internal and external links","Links are present in the application","All links direct to the correct destination without errors",To Be Tested,QA2,QA3,2023-05-09,2023-05-09
TC130,Check application behavior after cookie deletion,Medium,To Be Tested,"Delete cookies and access the application","Cookies are used for session management","User is prompted to log in again, and no session data is lost",To Be Tested,QA3,QA1,2023-05-10,2023-05-10
TC131,Validate CAPTCHA functionality on high-traffic actions,High,To Be Tested,"Perform actions that trigger CAPTCHA validation","CAPTCHA is implemented for specific actions","CAPTCHA challenge appears and must be solved to proceed",To Be Tested,QA1,QA2,2023-05-11,2023-05-11
TC132,Test functionality of 'Forgot Username' feature,Low,To Be Tested,"Use the 'Forgot Username' feature with registered email","Forgot Username feature is available","Username reminder is successfully sent to the user's email",To Be Tested,QA2,QA3,2023-05-12,2023-05-12
TC133,Verify load balancing effectiveness during peak usage,High,To Be Tested,"Simulate peak load conditions","Load balancing setup in the infrastructure","Application distributes load effectively without downtime",To Be Tested,QA3,QA1,2023-05-13,2023-05-13
TC134,Test for application compatibility with legacy browsers,Medium,To Be Tested,"Access application using legacy browsers","Support for legacy browsers is intended","Application maintains functionality in legacy browsers",To Be Tested,QA1,QA2,2023-05-14,2023-05-14
TC135,Validate encryption of sensitive data in databases,High,To Be Tested,"Check encryption status of sensitive data stored","Sensitive data encryption is mandatory","Sensitive information is stored in encrypted form",To Be Tested,QA2,QA3,2023-05-15,2023-05-15
TC136,Test real-time notifications for in-app activities,Medium,To Be Tested,"Perform an action that triggers a notification","Real-time notification system is implemented","Notifications are received immediately after the triggering action",To Be Tested,QA3,QA1,2023-05-16,2023-05-16
TC137,Verify the application's recovery from a database crash,High,To Be Tested,"Simulate a database crash","Database recovery processes are in place","Application recovers and reconnects to the database successfully",To Be Tested,QA1,QA2,2023-05-17,2023-05-17
TC138,Test for user input validation on all forms,High,To Be Tested,"Submit forms with invalid inputs","Input validation is implemented on forms","Forms reject invalid inputs with appropriate error messages",To Be Tested,QA2,QA3,2023-05-18,2023-05-18
TC139,Check for consistent application theme across all pages,Low,To Be Tested,"Navigate through various pages of the application","Consistent theme is intended across the application","Application theme is consistent and uniform across all pages",To Be Tested,QA3,QA1,2023-05-19,2023-05-19
TC140,Validate logout functionality across multiple tabs,Medium,To Be Tested,"Log out from one tab and check session on other open tabs","Multiple tabs with the same session are open","All tabs reflect the logout and end the session immediately",To Be Tested,QA1,QA2,2023-05-20,2023-05-20
TC141,Verify user feedback submission process,Medium,To Be Tested,"Submit feedback through the application's feedback form","Feedback form is available to users","Feedback is submitted successfully and acknowledgment is received",To Be Tested,QA2,QA3,2023-05-21,2023-05-21
TC142,Test multi-language support on user interface,Low,To Be Tested,"Switch application language settings","Multi-language support is enabled","Application successfully displays content in selected language",To Be Tested,QA3,QA1,2023-05-22,2023-05-22
TC143,Validate two-step verification setup,High,To Be Tested,"Enable two-step verification from user settings","Two-step verification feature is available","Two-step verification setup is completed successfully",To Be Tested,QA1,QA2,2023-05-23,2023-05-23
TC144,Check for app performance on low battery mode,Medium,To Be Tested,"Use application in low battery mode","Device is in low battery mode","Application maintains performance without additional drain",To Be Tested,QA2,QA3,2023-05-24,2023-05-24
TC145,Verify automatic logout after extended inactivity,High,To Be Tested,"Remain inactive in the application for extended period","Automatic logout feature for inactivity is configured","User is automatically logged out after period of inactivity",To Be Tested,QA3,QA1,2023-05-25,2023-05-25
TC146,Test user data export feature for GDPR compliance,Medium,To Be Tested,"Request export of personal data","GDPR compliance features enabled","User receives export of their personal data in a GDPR-compliant format",To Be Tested,QA1,QA2,2023-05-26,2023-05-26
TC147,Check application's response to network switch (Wi-Fi to data),Low,To Be Tested,"Switch network from Wi-Fi to mobile data while using app","Application is in use","Application seamlessly switches networks without disrupting user activity",To Be Tested,QA2,QA3,2023-05-27,2023-05-27
TC148,Validate push notification settings functionality,Medium,To Be Tested,"Adjust push notification settings in the application","Push notification settings are customizable","User is able to customize push notification settings successfully",To Be Tested,QA3,QA1,2023-05-28,2023-05-28
TC149,Test for correct handling of daylight saving time changes,High,To Be Tested,"Operate application through daylight saving time change","Daylight saving time change occurs","Application correctly adjusts for daylight saving time",To Be Tested,QA1,QA2,2023-05-29,2023-05-29
TC150,Verify deletion of account and all associated data,High,To Be Tested,"Delete user account through application settings","Account deletion option is provided","User account and all associated data are completely deleted",To Be Tested,QA2,QA3,2023-05-30,2023-05-30